text,level
"Budi pergi ke sekolah. Dia suka membaca buku cerita.",SD
"Proklamasi kemerdekaan Indonesia terjadi pada tahun 1945. Peristiwa ini menandai berakhirnya penjajahan.",SMP
"Fotosintesis adalah proses biokimia yang mengubah energi cahaya menjadi energi kimia pada tumbuhan. Klorofil berperan penting dalam reaksi terang.",SMA
"Adik bermain bola di halaman.",SD
"Revolusi industri 4.0 ditandai oleh integrasi teknologi digital dan fisik melalui Internet of Things serta kecerdasan buatan.",SMA
"Dalam pelajaran matematika, kita mempelajari aljabar dan geometri dasar.",SMP